<program xmlns:xsi = "http://www.w3.org/2001/XMLSchema-instance"
         xsi:noNamespaceSchemaLocation = "resources/program.xsd">

    <!--
        e11 - открыть двери
        e12 - закрыть двери
        e2 - успешное отктрытие или закрытие дверей
        e3 - припядсвие мешает закрыть двери
        e4 - двери сломались
        z1/z2 запуск открытия/закрытия дверей
        z3 - звонок в аварийную службу
    -->

    <parameters>
        <fixedOutput>true</fixedOutput>
        <populationSize>137</populationSize>
        <desiredFitness>0.0075</desiredFitness>
        <stateNumber>6</stateNumber>
        <partStay>0.47</partStay>
        <timeSmallMutation>286</timeSmallMutation>
        <timeBigMutation>255</timeBigMutation>
        <mutationProbability>0.08</mutationProbability>
    </parameters>

    <inputSet>e11, e12, e2, e3, e4</inputSet>
    <outputSet>z1, z2, z3</outputSet>

    <group>
        <tests>
            <test>
                <input>e11, e2, e12, e2</input>
                <output>z1, z2</output>
                <ptest>e11/z1; e2; e12/z2; e2</ptest>
            </test>
            <test>
                <input>e11, e2, e12, e2, e11, e2, e12, e2</input>
                <output>z1, z2, z1, z2</output>
                <ptest>e11/z1; e2; e12/z2; e2; e11/z1; e2; e12/z2; e2</ptest>
            </test>
            <test>
                <input>e11, e2, e12, e3, e2, e12, e2</input>
                <output>z1, z2, z1, z2</output>
                <ptest>e11/z1; e2; e12/z2; e3/z1; e2; e12/z2; e2</ptest>
            </test>
            <test>
                <input>e11, e2, e12, e2, e11, e2, e12, e3, e2, e12, e2</input>
                <output>z1, z2, z1, z2, z1, z2</output>
                <ptest>e11/z1; e2; e12/z2; e2; e11/z1; e2; e12/z2; e3/z1; e2; e12/z2; e2</ptest>
            </test>
            <test>
                <input>e11, e2, e12, e3, e2, e12, e3, e2, e12, e2</input>
                <output>z1, z2, z1, z2, z1, z2</output>
                <ptest>e11/z1; e2; e12/z2; e3/z1; e2; e12/z2; e3/z1; e2; e12/z2; e2</ptest>
            </test>
            <test>
                <input>e11, e4</input>
                <output>z1, z3</output>
                <ptest>e11/z1; e4/z3</ptest>
            </test>
            <test>
                <input>e11, e2, e12, e4</input>
                <output>z1, z2, z3</output>
                <ptest>e11/z1; e2; e12/z2; e4/z3</ptest>
            </test>
            <test>
                <input>e11, e2, e12, e2, e11, e4</input>
                <output>z1, z2, z1, z3</output>
                <ptest>e11/z1; e2; e12/z2; e2; e11/z1; e4/z3</ptest>
            </test>
            <test>
                <input>e11, e2, e12, e3, e4</input>
                <output>z1, z2, z1, z3</output>
                <ptest>e11/z1; e2; e12/z2; e3/z1; e4/z3</ptest>
            </test>
        </tests>
    </group>
</program>
